<?xml version="1.0" encoding="UTF-8"?>
<questionnaire-forms
        xmlns:xsi='http://www.w3.org/2001/XMLSchema-instance'
        xsi:noNamespaceSchemaLocation='jaxb/super_binding/XSDforWizard.xsd'>
    <questionnaire-form form-id="prevTestForm">
        <form-name>testPreviousButton</form-name>
        <pages>
            <page page-number="1" page-id="formPage1">
                <groups-of-questions>
                    <group group-id="page1Group1">
                        <group-name>Topic 1 of First Page</group-name>
                        <questions>
                            <question answer-required="false" question-id="pageOneGroupOne">
                                <question-title>Question one</question-title>
                                <question-type>TEXT</question-type>
                                <help-text>Type yes if it's topic one of first page?</help-text>
                                <dependent-questions>
                                    <dependent-question/>
                                </dependent-questions>
                                <options>
                                    <option></option>
                                </options>
                                <range/>
                                <grid>
                                    <columns>
                                        <column></column>
                                    </columns>
                                    <rows>
                                        <row></row>
                                    </rows>
                                </grid>
                                <default-answers>
                                    <default-answer>no</default-answer>
                                </default-answers>
                            </question>

                        </questions>
                    </group>
                    <group group-id="page1Group2">
                        <group-name>Topic 2 of First Page</group-name>
                        <questions>
                            <question answer-required="false" question-id="pageOneGroupTwo">
                                <question-title>Question two</question-title>
                                <question-type>MULTIPLECHOICE</question-type>
                                <help-text>Question two</help-text>
                                <dependent-questions>
                                    <dependent-question/>
                                </dependent-questions>
                                <options>
                                    <option>Male</option>
                                    <option>Female</option>
                                </options>
                                <range/>
                                <grid>
                                    <columns>
                                        <column></column>
                                    </columns>
                                    <rows>
                                        <row></row>
                                    </rows>
                                </grid>
                                <default-answers>
                                    <default-answer></default-answer>
                                </default-answers>
                            </question>
                        </questions>
                    </group>
                    <group group-id="page1Group3">
                        <group-name>Topic 3 of First Page</group-name>
                        <questions>
                            <question answer-required="false" question-id="pageOneGroupThree">
                                <question-title>Question three</question-title>
                                <question-type>TEXT</question-type>
                                <help-text>help</help-text>
                                <dependent-questions>
                                    <dependent-question/>
                                </dependent-questions>
                                <options>
                                    <option></option>
                                </options>
                                <range/>
                                <grid>
                                    <columns>
                                        <column></column>
                                    </columns>
                                    <rows>
                                        <row></row>
                                    </rows>
                                </grid>
                                <default-answers>
                                    <default-answer>NoName</default-answer>
                                </default-answers>
                            </question>

                        </questions>
                    </group>
                </groups-of-questions>
            </page>
            <page page-number="2" page-id="formPage2">
                <groups-of-questions>
                    <group group-id="page2Group1">
                        <group-name>Topic 1 of Second Page</group-name>
                        <questions>
                            <question answer-required="false" question-id="pageTwoGroupOne">
                                <question-title>Question four</question-title>
                                <question-type>MULTIPLECHOICE</question-type>
                                <help-text>Male or Female</help-text>
                                <dependent-questions>
                                    <dependent-question/>
                                </dependent-questions>
                                <options>
                                    <option>Male</option>
                                    <option>Female</option>
                                </options>
                                <range/>
                                <grid>
                                    <columns>
                                        <column></column>
                                    </columns>
                                    <rows>
                                        <row></row>
                                    </rows>
                                </grid>
                                <default-answers>
                                    <default-answer></default-answer>
                                </default-answers>
                            </question>
                        </questions>
                    </group>
                    <group group-id="page2Group2">
                        <group-name>Topic 2 of Second Page</group-name>
                        <questions>
                            <question answer-required="false" question-id="pageTwoGroupTwo">
                                <question-title>Question five</question-title>
                                <question-type>PARAGRAPHTEXT</question-type>
                                <help-text>Male or Female</help-text>
                                <dependent-questions>
                                    <dependent-question/>
                                </dependent-questions>
                                <options>
                                    <option></option>

                                </options>
                                <range/>
                                <grid>
                                    <columns>
                                        <column></column>
                                    </columns>
                                    <rows>
                                        <row></row>
                                    </rows>
                                </grid>
                                <default-answers>
                                    <default-answer></default-answer>
                                </default-answers>
                            </question>
                        </questions>
                    </group>
                </groups-of-questions>

            </page>
        </pages>
    </questionnaire-form>
</questionnaire-forms>